[
  {
    "country": "Canada",
    "pathway": "Study",
    "min_ielts": 6.5,
    "min_funds_usd": 22500,
    "min_degree": "high_school",
    "age_max": 50,
    "notes": "Study permits do not have a fixed maximum age in law, but applicants over 30 must show strong study plan and ties; schools commonly require IELTS Academic 6.5 overall for direct admission to most degree programs. From 2025, IRCC requires proof of living funds around CAD 20,635–22,895 per year (excluding tuition) for a single applicant, which is roughly USD 15,500–17,000, so planning at least USD 22,500 including buffer is realistic. Iranian applicants face longer security/background checks and possible extra documentation, but there is no specific nationality ban; however, embassy processing in Tehran is handled via other posts, which can increase delays."
  },
  {
    "country": "Canada",
    "pathway": "Work",
    "min_ielts": 6.0,
    "min_funds_usd": 3500,
    "min_degree": "diploma",
    "age_max": 60,
    "notes": "For employer-specific work permits under the Temporary Foreign Worker Program or International Mobility Program, there is no official maximum age, but those under 55 fit more easily in most labour market plans. Many regulated professions and employers expect at least CLB 6, which corresponds roughly to IELTS General Training 6.0–6.5. Temporary foreign workers must usually show they can support initial settlement (often a few thousand CAD) until first paycheque; exact amount is not codified but planning USD 3,000–4,000 is realistic. Iranian nationals may face additional security screening, and some occupations in sensitive sectors (energy, defence, dual-use technologies) may be harder to obtain work permits in due to sanctions and export-control concerns."
  },
  {
    "country": "Canada",
    "pathway": "PR",
    "min_ielts": 6.0,
    "min_funds_usd": 12000,
    "min_degree": "diploma",
    "age_max": 45,
    "notes": "Express Entry Federal Skilled Worker and Federal Skilled Trades applicants must meet minimum language of CLB 7 and CLB 5 respectively, which roughly corresponds to IELTS General 6.0–7.0 depending on band. For 2025, a single Express Entry applicant must show settlement funds of about CAD 15,263 (≈USD 11,500–12,000) unless exempt due to valid job offer or Canadian work experience. Express Entry CRS points decline sharply after age 29 and drop to near zero after 45, so applicants over 45 have severely reduced competitiveness even though there is technically no maximum age. Iranian applicants are eligible for Express Entry and provincial nominee programs, but may face longer background checks and must ensure funds are not subject to sanctions or transfer restrictions when documented."
  },
  {
    "country": "USA",
    "pathway": "Study",
    "min_ielts": 6.5,
    "min_funds_usd": 35000,
    "min_degree": "high_school",
    "age_max": 50,
    "notes": "U.S. schools typically require IELTS 6.5 or higher for admission to degree programs, although the F-1 visa itself does not mandate a specific test. For an F-1 visa, students must prove funds covering at least one year of tuition plus living costs, which for many programs realistically totals USD 30,000–50,000 depending on institution and location. There is no formal maximum age, but older applicants must show a credible study and career progression to satisfy nonimmigrant intent. Under the 2025 travel restrictions, many new nonimmigrant visas for Iranians, including student visas, are heavily restricted or suspended, though waivers may exist case-by-case and policies are under ongoing legal and political challenge."
  },
  {
    "country": "USA",
    "pathway": "Work",
    "min_ielts": 0,
    "min_funds_usd": 5000,
    "min_degree": "bachelor",
    "age_max": 55,
    "notes": "The U.S. does not require IELTS for work visas, but employers often expect strong English and sometimes standardized scores for internal screening. Specialty occupation visas (such as H-1B) generally require at least a bachelor degree or equivalent experience in a related field; L-1 and O-1 have different experience criteria. Applicants must typically show they can support themselves until first paycheck, so a few thousand USD in accessible funds is prudent though not codified. Current U.S. travel restrictions for Iranians significantly limit issuance of many work and temporary visas, but employment-based immigrant visas (EB-1/EB-2/EB-3) and some family-based categories may still proceed under exemptions or waivers; processing is often slower and usually handled via consulates outside Iran."
  },
  {
    "country": "USA",
    "pathway": "PR",
    "min_ielts": 0,
    "min_funds_usd": 10000,
    "min_degree": "bachelor",
    "age_max": 60,
    "notes": "Permanent residence in the U.S. is usually obtained through family sponsorship, employment-based categories, refugee/asylee adjustment, or programs like the Diversity Visa (DV) Lottery. There is no formal English test requirement or maximum age for most green card categories, but English and age affect employability and ease of integration. Employment-based categories often require at least a bachelor degree or exceptional ability, while some family and humanitarian categories do not specify education. Iranian nationals remain eligible in principle for certain immigrant categories and historically have been able to participate in the DV Lottery when Iran is listed as eligible, though security screening is strict and temporary travel bans can affect visa issuance logistics."
  },
  {
    "country": "Germany",
    "pathway": "Study",
    "min_ielts": 6.0,
    "min_funds_usd": 13500,
    "min_degree": "high_school",
    "age_max": 40,
    "notes": "German universities commonly ask for IELTS 6.0–6.5 for English-taught programs, while German-taught programs require language certificates like TestDaF or DSH. For 2025, the required blocked account amount is EUR 11,904 for one year (≈USD 12,500–13,000), used as proof of living expenses in addition to tuition. There is no legal maximum age, but applicants over about 30 may face more questions about academic progression when applying for a student residence permit. Iranian students are generally eligible but may face extra background checks; academic cooperation in sensitive scientific or dual-use fields can be scrutinized due to EU export-control and sanctions regimes."
  },
  {
    "country": "Germany",
    "pathway": "Work",
    "min_ielts": 0,
    "min_funds_usd": 3000,
    "min_degree": "bachelor",
    "age_max": 55,
    "notes": "Germany’s main skilled work pathways (including the EU Blue Card) typically require a recognized university degree and a job offer meeting salary thresholds, while other skilled worker routes accept vocational qualifications. There is no formal IELTS requirement since German or English skills depend on employer and job; many tech roles accept English-only, while regulated professions require German. Applicants should have savings to cover initial months before first salary; around EUR 2,500–3,500 (≈USD 2,700–3,800) is a realistic minimum for a single person. Iranian nationals can obtain German work visas but may face stricter checks in industries linked to dual-use technologies, energy, or advanced research because of EU and UN sanctions."
  },
  {
    "country": "Germany",
    "pathway": "PR",
    "min_ielts": 0,
    "min_funds_usd": 0,
    "min_degree": "high_school",
    "age_max": 67,
    "notes": "German permanent residence (Niederlassungserlaubnis) is usually available after several years of legal residence with stable income and social security contributions, often 4 years for EU Blue Card holders and 5 years for others. There is no specific IELTS or funds threshold at PR stage, but applicants must show secure livelihood without relying on social assistance and adequate pension contributions. Older applicants can qualify provided they can demonstrate long-term financial stability; formal maximum age aligns with general retirement age for some pension-related considerations. Iranian citizens with long-term residence in Germany can apply for PR under the same rules as other third-country nationals, though background checks and any security flags can lengthen processing times."
  },
  {
    "country": "Netherlands",
    "pathway": "Study",
    "min_ielts": 6.5,
    "min_funds_usd": 13000,
    "min_degree": "high_school",
    "age_max": 40,
    "notes": "Dutch universities commonly require IELTS 6.0–6.5 for English-taught bachelor and master programs. IND requires students to show sufficient funds for living costs, around EUR 1,094 per month in 2024/25 (≈EUR 11,000–12,000 per academic year), separate from tuition. There is no formal maximum age in law, but older applicants must show a coherent study and career plan to qualify for a residence permit. Iranian students need an MVV long-stay visa and residence permit; they may face export-control review in certain technical fields, and processing often occurs through embassies in neighbouring countries rather than Tehran."
  },
  {
    "country": "Netherlands",
    "pathway": "Work",
    "min_ielts": 0,
    "min_funds_usd": 3000,
    "min_degree": "bachelor",
    "age_max": 55,
    "notes": "The highly skilled migrant (kennismigrant) and EU Blue Card schemes typically require a university degree and a job offer meeting salary thresholds, while other work permits can use vocational qualifications. No IELTS score is mandated by immigration authorities; employers in international environments often expect strong English, and some roles require Dutch. Workers are normally expected to support themselves from their salary, but having several thousand EUR to cover initial expenses before first pay is prudent. Iranian nationals can receive Dutch work visas but may face enhanced screening in sectors sensitive under EU sanctions, especially energy, advanced tech, or dual-use research."
  },
  {
    "country": "Netherlands",